{
  "schema_version": 1,
  "package_id": "BAD-WRITER-CONTENTION",
  "mode": "full_chain",
  "active_ticket_id": "TKT-2026-06-22-ticket-0",
  "active_phase": "implementation_spawned",
  "last_completed_ticket_id": null,
  "source_lock": {
    "active_ticket_id": "TKT-2026-06-22-ticket-0",
    "status": "valid",
    "failure_marker": null
  },
  "writer_lock": {
    "held_by": "writer-a",
    "ticket_id": "TKT-2026-06-22-ticket-0"
  },
  "tickets": [
    {
      "order": 0,
      "id": "TKT-2026-06-22-ticket-0",
      "phase": "implementation_writer_locked",
      "completed_phases": [
        "pending",
        "source_lock_validated",
        "repository_validated",
        "plan_recorded",
        "repository_ticket_recorded",
        "implementation_writer_locked"
      ],
      "delivery": {
        "commit_sha": null,
        "pushed": false,
        "head_equals_upstream_proved": false
      }
    },
    {
      "order": 1,
      "id": "TKT-2026-06-22-ticket-1",
      "phase": "implementation_writer_locked",
      "completed_phases": [
        "pending",
        "source_lock_validated",
        "repository_validated",
        "plan_recorded",
        "repository_ticket_recorded",
        "implementation_writer_locked"
      ],
      "delivery": {
        "commit_sha": null,
        "pushed": false,
        "head_equals_upstream_proved": false
      }
    }
  ]
}
